{"schema":{"identity":"legitimacy.trajectory.trace","version":"0","hash":"sha256:8f5fe4d99ac420ef108f1c126ff3a9ce13d68ffb591433b3134f997e29a9eec9"},"run_id":{"value":"trajectory-composition-red","evidence":{"classification":"cites-raw-range","locator":{"record_index":0,"byte_offset":0,"byte_length":32,"digest":"sha256:5d88e2b18679db9fe3ee11902c11dfc72f5dcd936a2199776b7c128f20a793fc"}}},"adapter":{"identity":"adapter.trajectory-composition-fixture","version":"0","hash":"sha256:6d07728694c21dc78b6c308b581d034ea2c98bf9d748eaf4d693ae1730d89c5e"},"policy":{"identity":"policy.trajectory-composition.peer-half","version":"0","hash":"sha256:67b1e8e99864a4b47fbe891cabf0796e8a5690c737860eaf8adcde8c617ee10b"},"raw_capture":{"record_count":3,"digest":"sha256:3416747cf0e3f053f3247b2ba9fb0e3bd16bb61bbdbb14249f94d1a05cdfcc8c"},"events":[{"event_id":{"value":"red-event-0","evidence":{"classification":"cites-raw-range","locator":{"record_index":0,"byte_offset":0,"byte_length":32,"digest":"sha256:5d88e2b18679db9fe3ee11902c11dfc72f5dcd936a2199776b7c128f20a793fc"}}},"sequence_index":{"value":0,"evidence":{"classification":"cites-raw-range","locator":{"record_index":0,"byte_offset":0,"byte_length":32,"digest":"sha256:5d88e2b18679db9fe3ee11902c11dfc72f5dcd936a2199776b7c128f20a793fc"}}},"kind":{"value":"action-request","evidence":{"classification":"cites-raw-range","locator":{"record_index":0,"byte_offset":0,"byte_length":32,"digest":"sha256:5d88e2b18679db9fe3ee11902c11dfc72f5dcd936a2199776b7c128f20a793fc"}}},"source_item_id":{"value":"repeated-source-item","evidence":{"classification":"cites-raw-range","locator":{"record_index":0,"byte_offset":0,"byte_length":32,"digest":"sha256:5d88e2b18679db9fe3ee11902c11dfc72f5dcd936a2199776b7c128f20a793fc"}}},"raw_record":{"record_index":0,"digest":"sha256:c40fb14d8ea1f0b4b927c9b80981b8e101881ba9c9bf535bf0e85404a158f7bf"},"payload":{}},{"event_id":{"value":"red-event-1","evidence":{"classification":"cites-raw-range","locator":{"record_index":1,"byte_offset":0,"byte_length":32,"digest":"sha256:d1b69d6dc584bca6e226bd356430f7c376125269a42e414f85bd843337ead5f9"}}},"sequence_index":{"value":1,"evidence":{"classification":"cites-raw-range","locator":{"record_index":1,"byte_offset":0,"byte_length":32,"digest":"sha256:d1b69d6dc584bca6e226bd356430f7c376125269a42e414f85bd843337ead5f9"}}},"kind":{"value":"action-result","evidence":{"classification":"cites-raw-range","locator":{"record_index":1,"byte_offset":0,"byte_length":32,"digest":"sha256:d1b69d6dc584bca6e226bd356430f7c376125269a42e414f85bd843337ead5f9"}}},"source_item_id":{"value":"repeated-source-item","evidence":{"classification":"cites-raw-range","locator":{"record_index":1,"byte_offset":0,"byte_length":32,"digest":"sha256:d1b69d6dc584bca6e226bd356430f7c376125269a42e414f85bd843337ead5f9"}}},"raw_record":{"record_index":1,"digest":"sha256:51aab5e69e8a4ae97e36c72589b16e69b0f47008de7a930934be808089bc22ca"},"payload":{}},{"event_id":{"value":"red-event-2","evidence":{"classification":"cites-raw-range","locator":{"record_index":2,"byte_offset":0,"byte_length":32,"digest":"sha256:bbd738b7a07214e7e91049ace8fbbc142e4fe139bf1b85609383b13d34df39d8"}}},"sequence_index":{"value":2,"evidence":{"classification":"cites-raw-range","locator":{"record_index":2,"byte_offset":0,"byte_length":32,"digest":"sha256:bbd738b7a07214e7e91049ace8fbbc142e4fe139bf1b85609383b13d34df39d8"}}},"kind":{"value":"lifecycle","evidence":{"classification":"cites-raw-range","locator":{"record_index":2,"byte_offset":0,"byte_length":32,"digest":"sha256:bbd738b7a07214e7e91049ace8fbbc142e4fe139bf1b85609383b13d34df39d8"}}},"source_item_id":{"value":"repeated-source-item","evidence":{"classification":"cites-raw-range","locator":{"record_index":2,"byte_offset":0,"byte_length":32,"digest":"sha256:bbd738b7a07214e7e91049ace8fbbc142e4fe139bf1b85609383b13d34df39d8"}}},"raw_record":{"record_index":2,"digest":"sha256:073ed1a880d530b9258940923b39538e29af1cafcebcbdb920529702b7fae1de"},"payload":{}}]}
