{"schema":{"identity":"legitimacy.trajectory.trace","version":"0","hash":"sha256:8f5fe4d99ac420ef108f1c126ff3a9ce13d68ffb591433b3134f997e29a9eec9"},"run_id":{"value":"run-replay-1","evidence":{"classification":"cites-raw-range","locator":{"record_index":0,"byte_offset":0,"byte_length":17,"digest":"sha256:fc3167d588d04f7928b5f49343961b23ddbb652064af55d4553fc637c547ca42"}}},"adapter":{"identity":"adapter.vendor-neutral","version":"0","hash":"sha256:133af90f4ea97434e7443ed942e11f156a4f9287a2dbdbeb92e90b826c620717"},"policy":{"identity":"policy.replay-fixture","version":"0","hash":"sha256:2cefda2698d454b50f4925a87bd16cd7ad9b060803192478ee1615168968593a"},"raw_capture":{"record_count":2,"digest":"sha256:12f883114ee507496bafff4b56d15c61c648dc4226887bf9271c432fe7776cde"},"events":[{"event_id":{"value":"event-0","evidence":{"classification":"cites-raw-range","locator":{"record_index":0,"byte_offset":0,"byte_length":17,"digest":"sha256:fc3167d588d04f7928b5f49343961b23ddbb652064af55d4553fc637c547ca42"}}},"sequence_index":{"value":0,"evidence":{"classification":"cites-raw-range","locator":{"record_index":0,"byte_offset":0,"byte_length":17,"digest":"sha256:fc3167d588d04f7928b5f49343961b23ddbb652064af55d4553fc637c547ca42"}}},"kind":{"value":"observation","evidence":{"classification":"cites-raw-range","locator":{"record_index":0,"byte_offset":0,"byte_length":17,"digest":"sha256:fc3167d588d04f7928b5f49343961b23ddbb652064af55d4553fc637c547ca42"}}},"source_item_id":null,"raw_record":{"record_index":0,"digest":"sha256:31122006b0f380e85fd98f9e00ad9616cdd8663b1e0056e3c98e04c7f6e24ca7"},"payload":{}},{"event_id":{"value":"event-1","evidence":{"classification":"cites-raw-range","locator":{"record_index":1,"byte_offset":0,"byte_length":18,"digest":"sha256:2336abd857a49876517d0c72712a9ddae0c55f2042375cf6b04f9a786596942d"}}},"sequence_index":{"value":1,"evidence":{"classification":"cites-raw-range","locator":{"record_index":1,"byte_offset":0,"byte_length":18,"digest":"sha256:2336abd857a49876517d0c72712a9ddae0c55f2042375cf6b04f9a786596942d"}}},"kind":{"value":"observation","evidence":{"classification":"cites-raw-range","locator":{"record_index":1,"byte_offset":0,"byte_length":18,"digest":"sha256:2336abd857a49876517d0c72712a9ddae0c55f2042375cf6b04f9a786596942d"}}},"source_item_id":null,"raw_record":{"record_index":1,"digest":"sha256:c19f70c7b9b7999f842d8416ee6e6cf4d0fd10c388e1849387b509ae73478e1a"},"payload":{}}]}
