{"schema":{"identity":"legitimacy.trajectory.trace","version":"0","hash":"sha256:8f5fe4d99ac420ef108f1c126ff3a9ce13d68ffb591433b3134f997e29a9eec9"},"run_id":{"value":"trajectory-composition-benign","evidence":{"classification":"cites-raw-range","locator":{"record_index":0,"byte_offset":0,"byte_length":35,"digest":"sha256:c68c228794b3828b923101f941384b4e46919d207ad036371d4bfa9db80b72c6"}}},"adapter":{"identity":"adapter.trajectory-composition-fixture","version":"0","hash":"sha256:6d07728694c21dc78b6c308b581d034ea2c98bf9d748eaf4d693ae1730d89c5e"},"policy":{"identity":"policy.trajectory-composition.peer-half","version":"0","hash":"sha256:67b1e8e99864a4b47fbe891cabf0796e8a5690c737860eaf8adcde8c617ee10b"},"raw_capture":{"record_count":2,"digest":"sha256:bc887d6c7500ace9ef017470a13cc8ca5a3ce748abd439cc2995d4e4be9cfac5"},"events":[{"event_id":{"value":"benign-event-0","evidence":{"classification":"cites-raw-range","locator":{"record_index":0,"byte_offset":0,"byte_length":35,"digest":"sha256:c68c228794b3828b923101f941384b4e46919d207ad036371d4bfa9db80b72c6"}}},"sequence_index":{"value":0,"evidence":{"classification":"cites-raw-range","locator":{"record_index":0,"byte_offset":0,"byte_length":35,"digest":"sha256:c68c228794b3828b923101f941384b4e46919d207ad036371d4bfa9db80b72c6"}}},"kind":{"value":"observation","evidence":{"classification":"cites-raw-range","locator":{"record_index":0,"byte_offset":0,"byte_length":35,"digest":"sha256:c68c228794b3828b923101f941384b4e46919d207ad036371d4bfa9db80b72c6"}}},"source_item_id":{"value":"repeated-source-item","evidence":{"classification":"cites-raw-range","locator":{"record_index":0,"byte_offset":0,"byte_length":35,"digest":"sha256:c68c228794b3828b923101f941384b4e46919d207ad036371d4bfa9db80b72c6"}}},"raw_record":{"record_index":0,"digest":"sha256:f75251af379cf7934e6244e818e25913ade4730ccb3d66e41daf8850655019cc"},"payload":{}},{"event_id":{"value":"benign-event-1","evidence":{"classification":"cites-raw-range","locator":{"record_index":1,"byte_offset":0,"byte_length":35,"digest":"sha256:9adb4d072001466ba277880521816a0add9fe6c0f315da7c35eb3870fd9957cb"}}},"sequence_index":{"value":1,"evidence":{"classification":"cites-raw-range","locator":{"record_index":1,"byte_offset":0,"byte_length":35,"digest":"sha256:9adb4d072001466ba277880521816a0add9fe6c0f315da7c35eb3870fd9957cb"}}},"kind":{"value":"message","evidence":{"classification":"cites-raw-range","locator":{"record_index":1,"byte_offset":0,"byte_length":35,"digest":"sha256:9adb4d072001466ba277880521816a0add9fe6c0f315da7c35eb3870fd9957cb"}}},"source_item_id":{"value":"repeated-source-item","evidence":{"classification":"cites-raw-range","locator":{"record_index":1,"byte_offset":0,"byte_length":35,"digest":"sha256:9adb4d072001466ba277880521816a0add9fe6c0f315da7c35eb3870fd9957cb"}}},"raw_record":{"record_index":1,"digest":"sha256:5430086c8bee2255eea30e2ba671ffc7d137fa4dce39f2e7379b95066e47d20c"},"payload":{}}]}
